{
  "schema_version": "forge.evidence-index.v1",
  "app_id": "substitute-proof",
  "generated_at": "2026-05-25T12:10:00Z",
  "verification_plan": ".forge/verification-plan.json",
  "overall_status": "pass_with_substitutions",
  "slots": [
    {
      "id": "screenshots.activation-first-value",
      "class": "screenshot",
      "required": true,
      "status": "accepted",
      "artifact": ".forge/evidence/screenshots/activation-first-value.png"
    },
    {
      "id": "video.activation-flow",
      "class": "video",
      "required": true,
      "status": "substituted_approved",
      "artifact": ".forge/evidence/substitutes/video.activation-flow.json",
      "rationale": "Simulator video capture is unavailable in this fixture, but ordered screenshots and action log cover the flow.",
      "owner": "verification-agent",
      "limits": "Does not prove animation smoothness."
    }
  ],
  "blockers": [],
  "warnings": [
    "video substitute accepted"
  ]
}
